{
  "schema_version": "lane_task_card_v1",
  "card_id": "sp002-s011-post-closeout-reconciliation-v1",
  "session_id": "SP-002/S-011",
  "lane": "SP-002 final post-closeout reconciliation",
  "role": "validation",
  "source_goal": {"path": "Dashboard/Artifacts/Stage-Plan-SP-002/SP002_SGEOpenSourceNewcomerReadiness_LoopGoal.md", "sha256": "f5748bbe772bd0f7cd115959902b80c515c9f7377bfbe3c182c200820dc83508"},
  "base_context_refs": [
    {"path": "Dashboard/Artifacts/Stage-Plan-SP-002/SP002_SGEOpenSourceNewcomerReadiness_GoalPatch.md", "sha256": "3f3a3043adbdbfd0b6f0d106412ed6941a0f7cbb8bec59705530362d88646123"},
    {"path": "Dashboard/Artifacts/Stage-Plan-SP-002/SP002_S011_FinalClosure_OPCM.md", "sha256": "024f8b4afed7125ae989726dde4745e41c61dd9b08031878cbdf85c4c1fdd43b"},
    {"path": "Dashboard/Artifacts/Stage-Plan-SP-002/SP002_S011_FinalClosure_Closeout.md", "sha256": "f77b7a20bc2918459bcd4b92ff5a0895542eff0460cabd2f3d184f0db6ad028d"},
    {"path": "Dashboard/Artifacts/Stage-Plan-SP-002/SP002_S011_FinalValidation.md", "sha256": "f6ec103162ff595add8ea7c5d8044f6991ed083dff4c17cfd015213fa681c792"},
    {"path": "Dashboard/Artifacts/Stage-Plan-SP-002/SP002_S010_FinalUAT.md", "sha256": "171f08944eb92336bf60d935af1dfaf56351748e860dc4cad8dd4d25bc44b583"},
    {"path": "Dashboard/Artifacts/Stage-Plan-SP-002/SP002_S011_SemanticReview_Delta.md", "sha256": "ffcf2d0c62a4f43da5a0fe35616220b4d87bb18c70e9b18c5f0d334e1a765119"},
    {"path": "Dashboard/Current_State.md", "sha256": "c7e3e4438df903b0d133ed083c73898807b30507ff4a9bf5292c4185754e347a"},
    {"path": "Dashboard/Stage_Plans.md", "sha256": "56ec1cd61884e98baaab0b360e008b4b5b78b8cf0132cc09f2037dd156e613c2"},
    {"path": "Dashboard/Sessions.md", "sha256": "e7e99abeeaa9ca489a9fbe92aa429a3a107dd93a6c29706d4b8200e4c5f48d70"},
    {"path": "Dashboard/Session_Index.md", "sha256": "211bc0428548fa7fc697b905cb6c05bdbf1a7ae2158b7f4b398de3b78fa81b75"},
    {"path": "Dashboard/Archives/Sessions/SP-002.md", "sha256": "89036e2807455e4dfd3419b6e3c25fba7a04f0dfb79cb1fdea3ede01349b314c"},
    {"path": "Dashboard/Archives/Sessions/archive_manifest.json", "sha256": "c14084d1a7595ef47f5922ce6fa2e18a263b99eef63d82078bfcd5500ac49247"}
  ],
  "mode": "delta",
  "snapshot": {"snapshot_id": "sp002-s011-post-closeout-delta-2026-09-03", "parent_snapshot_ref": "Dashboard/Artifacts/Stage-Plan-SP-002/SP002_S011_PostCloseoutReconciliation.md"},
  "delta_read_set": ["git status --short", "git diff", "Dashboard/Artifacts/Stage-Plan-SP-002/SP002_CycleLedger.json", "public_export_manifest_v1.json", "kb/data/glossary_v1.json", "kb/docs/Glossary.md", "tests", "tools", "docs", "examples", "extensions", "LICENSE", "NOTICE"],
  "acceptance_criteria_ids": ["SP002-MH-01..12", "PROC-01..05", "completion rule", "final diff", "closeout-language"],
  "write_scope": ["Dashboard/Artifacts/Stage-Plan-SP-002/SP002_S011_PostCloseoutReconciliation.md"],
  "required_outputs": ["中文Read Manifest与Evidence Completeness Matrix", "逐项核对最终closeout、OPCM、Final Validation、Dashboard/KB和完整diff", "确认唯一且不冲突的最终verdict与reviewer/source", "明确PROC-01 topology exception与Goal completion影响", "不批准release/production/push/tag"],
  "maximum_claim_ref": {"summary": "最多确认当前阻断/完成状态的最终证据是否一致；不追溯消除未批准topology exception，不批准发布。", "authority_ref": "Dashboard/Artifacts/Stage-Plan-SP-002/SP002_SGEOpenSourceNewcomerReadiness_LoopGoal.md"},
  "forbidden_claims_ref": "Dashboard/Artifacts/Stage-Plan-SP-002/SP002_SGEOpenSourceNewcomerReadiness_LoopGoal.md",
  "topology": {"fork_context": false, "user_visible_required": false, "user_visible": false, "task_id": "sp002-s011-post-closeout-reconciliation-agent", "worktree": "."},
  "rebaseline_ref": "Dashboard/Artifacts/Stage-Plan-SP-002/SP002_S011_FinalValidation.md",
  "working_directory": ".",
  "execution_command": "python3 Dashboard/tools/session_registry.py reconcile --repo . --check && python3 Dashboard/tools/session_registry.py validate --repo . && python3 .codex/skills/sge-governed-checkpoints/scripts/guardrail_checklist.py --mode closeout-language --file Dashboard/Artifacts/Stage-Plan-SP-002/SP002_S011_FinalClosure_Closeout.md && python3 -m unittest discover -s tests -p 'test_*.py' && python3 tools/sge_public.py doctor && python3 kb/tools/render_kb.py --check && python3 Dashboard/tools/sge/s002_erbe_acceptance.py --phase red && python3 Dashboard/tools/sge/s002_erbe_acceptance.py --phase green && git diff --check"
}
