{
  "schema_version": "lane_task_card_v1",
  "card_id": "sp001-s015-reclosure-readiness-validation-v1",
  "session_id": "SP-001/S-015",
  "lane": "SP-001 RB-01 RB-02 reclosure readiness validation",
  "role": "validation",
  "source_goal": {"path": "Dashboard/Artifacts/SP001_SGEGovernanceMigration_LoopGoal.md", "sha256": "7ff403cb0b82b5fa4305bc39b5150625f30a4da2ba40ef4d8e344d19995982a5"},
  "base_context_refs": [
    {"path": "Dashboard/Artifacts/SP001_S015_PostCloseoutRepairValidation.md", "sha256": "9b585e92b12c0591768bc8f5b743b494c7cfa8c245b0115e75b240bbcb55fe54"},
    {"path": "Dashboard/Artifacts/SP001_S015_FinalClosure_OPCM.md", "sha256": "50f75c4723641e1df3dee3d0f89de9a60d714cad38346e4bc0c1fbfb49deafec"},
    {"path": "Dashboard/Big_Ideas.md", "sha256": "f4b1fe985bb69e19d606fcfa0610164a76cc23cf8a05bbc15879d4e64b4ddd99"},
    {"path": "Dashboard/Current_State.md", "sha256": "1894163a2cc963157cb561d5bd433ae9806c81b05d09b43251bc4615c400a6ca"},
    {"path": "Dashboard/Stage_Plans.md", "sha256": "93c8fc3d1f1ec8ef2f3fe0615f38a8ba68272c8805344d6c052c4b89fff38ad8"}
  ],
  "mode": "delta",
  "snapshot": {"snapshot_id": "sp001-s015-reclosure-readiness-validation-2026-09-02", "parent_snapshot_ref": "Dashboard/Artifacts/SP001_S015_PostCloseoutRepairValidation.md"},
  "delta_read_set": ["Dashboard/Artifacts/SP001_S015_FinalClosure_OPCM.md", "Dashboard/Big_Ideas.md", "Dashboard/Current_State.md", "Dashboard/Stage_Plans.md", "Dashboard/Sessions.md", "Dashboard/Artifacts/SP001_S015_PostCloseoutRepairValidation.md", "git diff"],
  "acceptance_criteria_ids": ["RB-01 OPCM rollback absorption", "RB-02 BI-001 live Next Step", "nonterminal surfaces consistent", "controlled reclosure readiness only"],
  "write_scope": ["Dashboard/Artifacts/SP001_S015_ReclosureReadinessValidation.md"],
  "required_outputs": ["Dashboard/Artifacts/SP001_S015_ReclosureReadinessValidation.md", "RB-01 RB-02 disposition", "reclosure allowed or blocked verdict"],
  "maximum_claim_ref": {"summary": "最多确认允许重新执行受控状态收束；不证明 reclosure 后状态或 final post-closeout。", "authority_ref": "Dashboard/Artifacts/SP001_S015_PostCloseoutRepairValidation.md"},
  "forbidden_claims_ref": "Dashboard/Artifacts/SP001_QualityRecovery_ERBE_Contract.json",
  "topology": {"fork_context": false, "user_visible_required": false, "user_visible": false, "task_id": "sp001-s015-reclosure-readiness-validation", "worktree": "."},
  "rebaseline_ref": "Dashboard/Artifacts/SP001_S015_FinalValidation_ContextBootstrap.json",
  "working_directory": ".",
  "execution_command": "python3 Dashboard/tools/quality_recovery_erbe.py --phase full"
}
