{
  "schema_version": "lane_task_card_v1",
  "card_id": "sp001-s015-final-validation-v1",
  "session_id": "SP-001/S-015",
  "lane": "SP-001 full-baseline final Validation",
  "role": "validation",
  "source_goal": {"path": "Dashboard/Artifacts/SP001_SGEGovernanceMigration_LoopGoal.md", "sha256": "27e242e8ece4bd86179760316b295712ca70eaffccc1208c9f674307048a1ae6"},
  "base_context_refs": [
    {"path": "Dashboard/Artifacts/SP001_QualityRecovery_ContextBootstrap.json", "sha256": "428d1dfd5e45b431cd158212607284ad08f2413793c60c92353eba393f8b69cb"},
    {"path": "Dashboard/Artifacts/SP001_QualityRecovery_ERBE_Contract.json", "sha256": "56789c7d7ab64b5f453eb94a7f9c134aff4b9e28ebb2e23f04b2ffa32d5f9ae3"},
    {"path": "Dashboard/Artifacts/SP001_QualityRecovery_ERBE_Cases.json", "sha256": "39bd8502b7677450e7739df719190aacb5e2e0f19d42fb95eabae1a326405642"},
    {"path": "Dashboard/Artifacts/SP001_S015_FinalClosure_OPCM.md", "sha256": "a4fe7234cad8d0f27c147ec7dba81651e775f79715b6764a65281f36749973e9"},
    {"path": "Dashboard/Artifacts/SP001_S015_FinalClosure_Closeout.md", "sha256": "edad484372edbe19fb25fc0bb7e12d0a14958cdd44b29fdc77feccbfd0fd5010"}
  ],
  "mode": "full_baseline",
  "snapshot": {"snapshot_id": "sp001-s015-final-validation-2026-09-02", "parent_snapshot_ref": null},
  "delta_read_set": ["AGENTS.md", "README.md", ".gitignore", ".codex/skills/sge-governed-checkpoints", "kb", "Dashboard", "tests", "git diff and status"],
  "acceptance_criteria_ids": ["MH-01..MH-15", "S001-AC-01..03", "PROC-01..02", "QR-RED-01..06", "QR-GREEN-01"],
  "write_scope": [],
  "required_outputs": ["中文任务与 claim boundary 解释", "Read Manifest", "Evidence Completeness Matrix audit", "blocking/non-blocking findings", "SGC SI-1..SI-6", "final verdict and allowed wording"],
  "maximum_claim_ref": {"summary": "仅判断当前 repo-local SP-001 completion predicates；不判断 release 或 production。", "authority_ref": "Dashboard/Artifacts/SP001_QualityRecovery_GoalPatch.md"},
  "forbidden_claims_ref": "Dashboard/Artifacts/SP001_QualityRecovery_ERBE_Contract.json",
  "topology": {"fork_context": false, "user_visible_required": false, "user_visible": false, "task_id": "sp001-s015-final-validation", "worktree": "."},
  "rebaseline_ref": "Dashboard/Artifacts/SP001_S015_FinalValidation_ContextBootstrap.json",
  "working_directory": ".",
  "execution_command": "python3 Dashboard/tools/doctor.py --repo ."
}

