{
  "schema_version": "lane_task_card_v1",
  "card_id": "sp003-s018-end-user-lifecycle-builder-v1",
  "session_id": "SP-003/S-018",
  "lane": "S-018 end-user lifecycle",
  "role": "builder",
  "source_goal": {"path": "Dashboard/Artifacts/SP003_OpenSourceDistributionArchitecture_GoalContract.json", "sha256": "a7910428c9fb0832609a96fd403d0a46df7da32c87139c86a5f4548a7bb51421"},
  "base_context_refs": [
    {"path": "AGENTS.md", "sha256": "1362597c1fa59259b09004f7b52aebb4a485eab7c6ac944596d124e0827ed6a5"},
    {"path": "Dashboard/Artifacts/SP003_OpenSourceDistributionArchitecture_StagePlan.md", "sha256": "09d400afc9d733dff93c3d77d56a9dd94a3ab9e1af29ca81c0731748e123a5cd"},
    {"path": "Dashboard/Artifacts/SP003_S016_Design.md", "sha256": "5268573cafaf0f54f1a526a0419df7e0e3d607573c0832a6290ed78b9998296e"},
    {"path": "Dashboard/Artifacts/SP003_S017_ProjectionEvidence.json", "sha256": "b0214c8a03072a6f7450094fec55dc359893bd13132cb181c7effe2ad9d870b2"},
    {"path": "tools/sge_public.py", "sha256": "3810e8b695c9a9030971f1bfc19237dad438297f1c7b8cc1e932f40565815023"},
    {"path": "docs/Beginner_Guide_CN.md", "sha256": "5e4cf2b5e3ac2bcbccce3000a8aa850b64ecff303aa97f15d6880a0002d6ae91"},
    {"path": "docs/Quick_Start_CN.md", "sha256": "b1ee5cffb54f550f9ce941e7a1575ee2ba838bdb59cf4645441a316396c7fed8"}
  ],
  "mode": "full_baseline",
  "snapshot": {"snapshot_id": "sp003-s018-builder-baseline-2026-09-03", "parent_snapshot_ref": null},
  "delta_read_set": [],
  "acceptance_criteria_ids": ["ODA-MH-05", "ODA-MH-06", "ODA-MH-07", "S018-AC-01", "S018-AC-02", "S018-AC-03"],
  "write_scope": ["tools/sge_public.py", "docs/Beginner_Guide_CN.md", "docs/Quick_Start_CN.md", "Dashboard/Artifacts/SP003_S018_LifecycleContract.md", "Dashboard/Artifacts/SP003_S018_LifecycleEvidence.json"],
  "required_outputs": ["普通用户默认使用当前公开仓 source，只需 target；--source 仅高级/测试", "install/upgrade/doctor/uninstall 的 target authority、backup、record、rollback/recoverable 行为可重算", "中文 lifecycle contract、clean-room evidence 与明确不支持的跨平台/生产主张", "不执行 GitHub create/push/tag/release/read-back"],
  "maximum_claim_ref": {"summary": "只支撑本地 public source 的 end-user lifecycle candidate evidence；不支撑公开仓已发布、跨平台或 production readiness。", "authority_ref": "Dashboard/Artifacts/SP003_OpenSourceDistributionArchitecture_StagePlan.md"},
  "forbidden_claims_ref": "Dashboard/Artifacts/SP003_OpenSourceDistributionArchitecture_LoopGoal.md",
  "topology": {"fork_context": false, "user_visible_required": false, "user_visible": false, "task_id": "sp003-s018-builder-agent", "worktree": "."},
  "rebaseline_ref": "Dashboard/Artifacts/SP003_S017_ProjectionEvidence.json",
  "working_directory": ".",
  "execution_command": "python3 -m unittest tests.test_public_candidate tests.test_public_projection && python3 tools/sge_public.py doctor && git diff --check"
}
