{
  "schema_version": "lane_task_card_v1",
  "card_id": "sp003-s017-deterministic-projection-builder-v1",
  "session_id": "SP-003/S-017",
  "lane": "S-017 maintainer deterministic projection",
  "role": "builder",
  "source_goal": {"path": "Dashboard/Artifacts/SP003_OpenSourceDistributionArchitecture_GoalContract.json", "sha256": "a7910428c9fb0832609a96fd403d0a46df7da32c87139c86a5f4548a7bb51421"},
  "base_context_refs": [
    {"path": "AGENTS.md", "sha256": "1362597c1fa59259b09004f7b52aebb4a485eab7c6ac944596d124e0827ed6a5"},
    {"path": "Dashboard/Artifacts/SP003_OpenSourceDistributionArchitecture_StagePlan.md", "sha256": "09d400afc9d733dff93c3d77d56a9dd94a3ab9e1af29ca81c0731748e123a5cd"},
    {"path": "Dashboard/Artifacts/SP003_S016_Design.md", "sha256": "5268573cafaf0f54f1a526a0419df7e0e3d607573c0832a6290ed78b9998296e"},
    {"path": "Dashboard/Artifacts/SP003_S016_ERBE_Contract.json", "sha256": "1d9de9aa6a91fc9a8ff8450e3d045dc7fa047477595ee95097b1e29fcfea296d"},
    {"path": "Dashboard/Artifacts/SP003_S016_ERBE_Cases.json", "sha256": "d608b11f0cc5985d208d18cb1869a9bac5521c6ab36ad229e893c35d9d20385c"},
    {"path": "Dashboard/Artifacts/SP003_S016_SemanticReview.md", "sha256": "d90e71a16c5dc89f6283251ac1e59e868f8f4ee760977b14246bdcf18d96e504"},
    {"path": "public_export_manifest_v1.json", "sha256": "ba7b7f3a34949ba5b1f785db9f6a28f7961b40bba14523a4ca4aa6d2db86452a"},
    {"path": "tools/sge_public.py", "sha256": "3810e8b695c9a9030971f1bfc19237dad438297f1c7b8cc1e932f40565815023"}
  ],
  "mode": "full_baseline",
  "snapshot": {"snapshot_id": "sp003-s017-builder-baseline-2026-09-03", "parent_snapshot_ref": null},
  "delta_read_set": [],
  "acceptance_criteria_ids": ["ODA-MH-02", "ODA-MH-03", "S017-AC-01", "S017-AC-02", "S017-AC-03"],
  "write_scope": ["tools/sge_public.py", "tests/test_public_candidate.py", "tests/test_public_projection.py", "Dashboard/Artifacts/SP003_S017_ProjectionContract.md", "Dashboard/Artifacts/SP003_S017_ProjectionEvidence.json"],
  "required_outputs": ["实现 fresh-root、exact allowlist、default-deny、完整 tree inventory 与未知/路径/对象类型/私有 residue fail-closed", "生成可重算 projection metadata，分离 source/manifest/tool/export-run/candidate identity，保持不生成 projection_commit/release_tag", "补充 unknown、absolute path、symlink/gitlink/LFS/nested repo/unexpected binary、dirty tree、digest drift 与 destination safety negative cases", "保持本 Session 无 GitHub create/push/tag/release/read-back；candidate 仅为本地 projection evidence", "同步或说明 maintained non-unit gate 的 BDD 影响"],
  "maximum_claim_ref": {"summary": "只支撑 S-017 maintainer local deterministic projection candidate evidence；不支撑 end-user lifecycle、license rights、release、GitHub mutation 或 production。", "authority_ref": "Dashboard/Artifacts/SP003_S016_Design.md"},
  "forbidden_claims_ref": "Dashboard/Artifacts/SP003_OpenSourceDistributionArchitecture_LoopGoal.md",
  "topology": {"fork_context": false, "user_visible_required": false, "user_visible": false, "task_id": "sp003-s017-builder-agent", "worktree": "."},
  "rebaseline_ref": "Dashboard/Artifacts/SP003_S016_ValidationStateSnapshot.json",
  "working_directory": ".",
  "execution_command": "python3 -m unittest tests.test_public_candidate tests.test_public_projection && python3 tools/sge_public.py doctor"
}
