{
  "schema_version":"lane_task_card_v1",
  "card_id":"sp004-s024-delta-validation-v1",
  "session_id":"SP-004/S-024",
  "lane":"S-024 blocker-fix delta Validation",
  "role":"validation",
  "source_goal":{"path":"Dashboard/Artifacts/SP004_SemxResidueOpenSourceGaps_LoopGoal.md","sha256":"f7e55d3e1cb0d8284d8be9e16534fae34d75ac863fcb410430847f4dfbd11a08"},
  "base_context_refs":[{"path":"Dashboard/Artifacts/SP004_S024_ValidationStateSnapshot.json","sha256":"64a38addafd39852e5f91b20a0f64ed3b162acfc599bf13aeec26b37c58c56ff"},{"path":"Dashboard/Artifacts/SP004_S024_PDIRepair.md","sha256":"d1624b36f5b46da6dd0231277eb29db771e70daac4e89b96249a370340c9416b"},{"path":"Dashboard/Artifacts/SP004_S024_ERBE_RED_GREEN.json","sha256":"0342257034442cb16dbcbde82c0cd2b0a2448f34a785ffdf2fcd0127e241e8ce"},{"path":"Dashboard/Artifacts/SP004_S023_Cases.json","sha256":"4ffb3b1a23071238295184bee5567945ec3d4ec2ca6ea33b41bb584428262fb3"}],
  "mode":"delta",
  "snapshot":{"snapshot_id":"sp004-s024-delta-validation-2026-09-05","parent_snapshot_ref":"Dashboard/Artifacts/SP004_S024_ValidationStateSnapshot.json"},
  "delta_read_set":["PDI repair diff","SP004_S024_PDIRepair.md","SP004_S024_ERBE_RED_GREEN.json","doctor.py locator/residue functions","tests and BDD card","frozen S-023 Cases","final Dashboard Session/ledger state"],
  "acceptance_criteria_ids":["GAP-MH-07","GAP-MH-09","GAP-MH-10","S024-AC-01","S024-AC-02","SGC-SI-1..SI-6"],
  "write_scope":["Dashboard/Artifacts/SP004_S024_DeltaValidationReview.md","Dashboard/Artifacts/SP004_S024_DeltaValidationStateSnapshot.json"],
  "required_outputs":["完整 delta Read Manifest","独立重算三项 blocker、RED/GREEN identity、PDI direct-fix/verification/recurrence prevention","最终 diff 与 Dashboard/KB review","唯一 delta verdict；不得把 producer evidence 当独立验证"],
  "maximum_claim_ref":{"summary":"最多支持 S-024 blocker 修复后的有界独立验证；不支持后续 Session、rights、release、remote 或 Goal complete。","authority_ref":"Dashboard/Artifacts/SP004_S024_ValidationReview.md"},
  "forbidden_claims_ref":"Dashboard/Artifacts/SP004_SemxResidueOpenSourceGaps_LoopGoal.md",
  "topology":{"fork_context":false,"user_visible_required":false,"user_visible":false,"task_id":"sp004-s024-delta-validation-agent","worktree":"."},
  "rebaseline_ref":"Dashboard/Artifacts/SP004_S024_ValidationStateSnapshot.json",
  "working_directory":".",
  "execution_command":"python3 .codex/skills/sge-governed-checkpoints/scripts/lane_task_card.py validate Dashboard/Artifacts/SP004_S024_DeltaValidationLaneTaskCard.json --repo . --expected-card-sha256 <rendered-card-sha256> && python3 -m unittest discover -s tests -p 'test_*.py' && python3 Dashboard/tools/doctor.py --repo . && git diff --check"
}
