{
  "schema_version": "lane_task_card_v1",
  "card_id": "s001-sge-governance-planning-landing-repair-v1",
  "session_id": "SP-001/S-001",
  "lane": "S-001 validation blocker repair",
  "role": "builder",
  "source_goal": {
    "path": "Dashboard/Artifacts/SP001_SGEGovernanceMigration_LoopGoal.md",
    "sha256": "30dc6353d175ebb954d6d010f822753a8397ceba68fc501b66fdc3ee57047d2a"
  },
  "base_context_refs": [
    {"path": "Dashboard/Artifacts/SP001_SGEGovernanceMigration_Plan.md", "sha256": "e58deed4b0466b77ca263dc6e5560beba4fe6d06c61f8487242ff141cdb26cf6"},
    {"path": "Dashboard/Artifacts/SP001_SGEGovernanceMigration_ContextBootstrap.json", "sha256": "6a57027142c1b6ec61f0396b88dfd25dd0834b9cae59da430cd7b680da87f595"},
    {"path": "Dashboard/Artifacts/S001_SGEGovernancePlanningLanding_Design.md", "sha256": "2394f176e82f5a94ff84195599122388af7346973c0ace28bf4823682474da79"},
    {"path": "Dashboard/Artifacts/S001_SGEGovernancePlanningLanding_Closeout.md", "sha256": "cf556c2232f187952cd8ff410c40c8aac9114d55f5d294efe562f02941af3401"},
    {"path": "Dashboard/Artifacts/S001_SGEGovernancePlanningLanding_ValidationReview.md", "sha256": "91e905427b77ad9a9021cce73c16f06b0b21ef805039423d0aadce144fa38697"}
  ],
  "mode": "delta",
  "snapshot": {
    "snapshot_id": "s001-planning-landing-repair-delta-2026-09-01",
    "parent_snapshot_ref": "Dashboard/Artifacts/S001_SGEGovernancePlanningLanding_ValidationReview.md"
  },
  "delta_read_set": [
    "Dashboard/Artifacts/SP001_SGEGovernanceMigration_ContextBootstrap.json",
    "Dashboard/Artifacts/SP001_SGEGovernanceMigration_Plan.md",
    "Dashboard/Artifacts/S001_SGEGovernancePlanningLanding_Closeout.md",
    "Dashboard/Artifacts/S001_SGEGovernancePlanningLanding_ValidationReview.md"
  ],
  "acceptance_criteria_ids": ["S001-AC-01", "S001-AC-03", "MH-09", "MH-10", "B-01", "B-02", "B-03"],
  "write_scope": [
    "Dashboard/Artifacts/SP001_SGEGovernanceMigration_ContextBootstrap.json",
    "Dashboard/Artifacts/SP001_SGEGovernanceMigration_Plan.md",
    "Dashboard/Artifacts/S001_SGEGovernancePlanningLanding_Closeout.md",
    "Dashboard/Agent_Logs/2026-09-01__S-001__builder-repair.md"
  ],
  "required_outputs": [
    "逐字恢复本轮完整 Raw User Intent authority，不用 intake 摘要替换原文",
    "补齐迁移计划的 S-005、S-006、目标目录清单、接口变化表和逐项验收矩阵，保持不启动迁移的边界",
    "在 closeout 记录 Design Delta 有、Goal Scope Delta 无，并解释 manifest 延后至 S-004 的理由和 Semantic Reviewer 裁决",
    "消除 closeout 中语言门已通过与仍 pending 的矛盾，并把完整计划表述与修复后的证据对齐",
    "生成 builder-repair Agent Log，列出实际修复和重跑门禁，不伪造历史 lane 日志"
  ],
  "maximum_claim_ref": {
    "summary": "只修复首轮 Validation 的 B-01..B-03；保持 S-001=Doing，不启动 S-002，不改变 parent Goal 范围。",
    "authority_ref": "Dashboard/Artifacts/S001_SGEGovernancePlanningLanding_ValidationReview.md"
  },
  "forbidden_claims_ref": "Dashboard/Artifacts/SP001_SGEGovernanceMigration_LoopGoal.md",
  "topology": {
    "fork_context": false,
    "user_visible_required": false,
    "user_visible": false,
    "task_id": "s001-planning-landing-builder-repair-agent",
    "worktree": "."
  },
  "rebaseline_ref": "Dashboard/Artifacts/S001_SGEGovernancePlanningLanding_ValidationReview.md",
  "working_directory": ".",
  "execution_command": "git diff -- Dashboard/Artifacts/SP001_SGEGovernanceMigration_ContextBootstrap.json Dashboard/Artifacts/SP001_SGEGovernanceMigration_Plan.md Dashboard/Artifacts/S001_SGEGovernancePlanningLanding_Closeout.md"
}
