{
  "schema_version":"lane_task_card_v1",
  "card_id":"repository-capability-panorama-closure-v1",
  "session_id":"ADHOC/REPOSITORY-CAPABILITY-PANORAMA",
  "lane":"全景任务收束草案",
  "role":"closure",
  "source_goal":{"path":"Dashboard/Artifacts/Session-ADHOC-REPOSITORY-CAPABILITY-PANORAMA/RepositoryCapabilityPanorama_Design.md","sha256":"2aaa245234f4c0f6510b50714c782c82118ce9ec159162a5a8adfbf990fd2d9c"},
  "base_context_refs":[{"path":"Dashboard/Artifacts/Session-ADHOC-REPOSITORY-CAPABILITY-PANORAMA/RepositoryCapabilityPanorama_Data.json","sha256":"f38f99036d927ce8c3b75c532e6f0291b948405ae8d534ee98d62f70ab6f4b57"},{"path":"Dashboard/Artifacts/Session-ADHOC-REPOSITORY-CAPABILITY-PANORAMA/RepositoryCapabilityPanorama.md","sha256":"51923fef6752ac5afe8adbb4da7b55e267712683c3568dd24c153350a89ce558"},{"path":"Dashboard/Artifacts/Session-ADHOC-REPOSITORY-CAPABILITY-PANORAMA/RepositoryCapabilityPanorama_Audit_Report.md","sha256":"f62e1ad881dfe4efb0ba38a4e5e2b74a52ee63485061d177f74a0d6dd39bb670"}],
  "mode":"full_baseline",
  "snapshot":{"snapshot_id":"repository-capability-panorama-closure-2026-09-04","parent_snapshot_ref":null},
  "delta_read_set":["RepositoryCapabilityPanorama Design/Data/Markdown/HTML/Audit/Generator","Context Bootstrap","lane cards/prompts/audit report","original user must-haves","git diff","SGC/closeout/closeout-language rules"],
  "acceptance_criteria_ids":["PAN-DESIGN-01","PAN-DESIGN-02","PAN-DESIGN-03","PAN-DESIGN-04"],
  "write_scope":["Dashboard/Artifacts/Session-ADHOC-REPOSITORY-CAPABILITY-PANORAMA/RepositoryCapabilityPanorama_Closeout.md"],
  "required_outputs":["中文 closeout 草案，逐项覆盖全景、所有能力、质量/残留、开源缺口、小白指南与发布指南","记录两次 Builder agent 未落盘与 Orchestrator 机械生成的 Single-Agent Exception","包含验证交接包、Closeout language verdict、SGC、ERBE/BDD、KB/Dashboard review、Scope Delta 与 deferred scan","不得在独立 Validation 前声称 final pass/done"],
  "maximum_claim_ref":{"summary":"只形成待独立 Validation 的 closeout 草案；不证明任务或开源发布完成。","authority_ref":"Dashboard/Artifacts/Session-ADHOC-REPOSITORY-CAPABILITY-PANORAMA/RepositoryCapabilityPanorama_Design.md"},
  "forbidden_claims_ref":"Dashboard/Artifacts/Session-ADHOC-REPOSITORY-CAPABILITY-PANORAMA/RepositoryCapabilityPanorama_ContextBootstrap.json",
  "topology":{"fork_context":false,"user_visible_required":false,"user_visible":false,"task_id":"repository-capability-panorama-closure","worktree":"."},
  "rebaseline_ref":"Dashboard/Artifacts/Session-ADHOC-REPOSITORY-CAPABILITY-PANORAMA/RepositoryCapabilityPanorama_ContextBootstrap.json",
  "working_directory":".",
  "execution_command":"写入 RepositoryCapabilityPanorama_Closeout.md 草案；不得编辑其他文件；最终 verdict 保持 pending independent validation"
}
