{
  "schema_version": "lane_task_card_v1",
  "card_id": "sp001-s015-semantic-topology-reconciliation-v1",
  "session_id": "SP-001/S-015",
  "lane": "SP-001 Semantic topology reconciliation",
  "role": "semantic",
  "source_goal": {
    "path": "Dashboard/Artifacts/Stage-Plan-SP-001/SP001_SGEGovernanceMigration_LoopGoal.md",
    "sha256": "7e65566480056258433bdbeb7795357c92e09386b127d539735328275aedb881"
  },
  "base_context_refs": [
    {
      "path": "Dashboard/Artifacts/Stage-Plan-SP-001/SP001_S015_SemanticReview_Delta.md",
      "sha256": "1f7e0dea871fe25f20dd4e5f2aadc885b460f4fb3e5280de0094d9551c8a1c59"
    },
    {
      "path": "Dashboard/Agent_Logs/2026-09-02__SP-001-S012-S014__builder.md",
      "sha256": "2fe79142462f88c40ae5c8bcf9ef51f4348baff8e3a2aa980cf919f8ac64ab0f"
    },
    {
      "path": "Dashboard/Artifacts/Stage-Plan-SP-001/SP001_S015_FinalClosure_OPCM.md",
      "sha256": "ece19e953789f78e7cdf5a6cee55b82e0b16c680fdca7295d979abba5f0d3941"
    },
    {
      "path": "Dashboard/Artifacts/Stage-Plan-SP-001/SP001_S015_FinalClosure_Closeout.md",
      "sha256": "79e449d2bcbf9952f88925209384ad800623d2ccfa313249a81624b14850be62"
    }
  ],
  "mode": "delta",
  "snapshot": {
    "snapshot_id": "sp001-s015-semantic-topology-reconciliation-2026-09-02",
    "parent_snapshot_ref": "Dashboard/Artifacts/Stage-Plan-SP-001/SP001_S015_SemanticReview_Delta.md"
  },
  "delta_read_set": [
    "Dashboard/Agent_Logs/2026-09-02__SP-001-S012-S014__builder.md",
    "Dashboard/Artifacts/Stage-Plan-SP-001/SP001_S012_QualityRecovery_Closeout.md",
    "Dashboard/Artifacts/Stage-Plan-SP-001/SP001_S013_SemanticGovernance_Closeout.md",
    "Dashboard/Artifacts/Stage-Plan-SP-001/SP001_S014_ToolchainQuality_Closeout.md",
    "Dashboard/Artifacts/Stage-Plan-SP-001/SP001_S015_FinalClosure_OPCM.md",
    "Dashboard/Artifacts/Stage-Plan-SP-001/SP001_S015_FinalClosure_Closeout.md",
    "git diff"
  ],
  "acceptance_criteria_ids": [
    "SEM-B04 topology-disposition",
    "Multi-Agent Gate bounded exception",
    "promotion eligibility boundary"
  ],
  "write_scope": [
    "Dashboard/Artifacts/Stage-Plan-SP-001/SP001_S015_SemanticReview_TopologyReconciliation.md"
  ],
  "required_outputs": [
    "Dashboard/Artifacts/Stage-Plan-SP-001/SP001_S015_SemanticReview_TopologyReconciliation.md",
    "SEM-B04 closed or open verdict",
    "Design Freeze Validity",
    "Implementation Entry Readiness",
    "whether independent Validation may start before explicit promotion"
  ],
  "maximum_claim_ref": {
    "summary": "仅判断 Builder topology disposition 是否关闭 B04，以及下一安全步骤；不直接 promotion、不关闭 SP-001。",
    "authority_ref": "Dashboard/Artifacts/Stage-Plan-SP-001/SP001_S015_SemanticReview_Delta.md"
  },
  "forbidden_claims_ref": "Dashboard/Artifacts/Stage-Plan-SP-001/SP001_QualityRecovery_ERBE_Contract.json",
  "topology": {
    "fork_context": false,
    "user_visible_required": false,
    "user_visible": false,
    "task_id": "sp001-s015-semantic-topology-reconciliation",
    "worktree": "."
  },
  "rebaseline_ref": "Dashboard/Artifacts/Stage-Plan-SP-001/SP001_S015_FinalValidation_ContextBootstrap.json",
  "working_directory": ".",
  "execution_command": "python3 .codex/skills/sge-governed-checkpoints/scripts/guardrail_checklist.py --mode semantic"
}
