{
  "schema_version":"lane_task_card_v1",
  "card_id":"repository-capability-panorama-final-validation-v1",
  "session_id":"ADHOC/REPOSITORY-CAPABILITY-PANORAMA",
  "lane":"能力全景独立最终验证",
  "role":"validation",
  "source_goal":{"path":"Dashboard/Artifacts/RepositoryCapabilityPanorama_Design.md","sha256":"63ce5746aef30d809ba05e183e7aa5cc5316d06b27b43f57ab6e497aa3d64fb3"},
  "base_context_refs":[{"path":"Dashboard/Artifacts/RepositoryCapabilityPanorama_Data.json","sha256":"3251f9515435b8c2d4185ecefeaf50b329a9f8af870e01015f2df812c6a231b6"},{"path":"Dashboard/Artifacts/RepositoryCapabilityPanorama.md","sha256":"14779f76559b582a740eaa7d1e5c6129d120c3cbd13e6bf1579a817a1558ed62"},{"path":"Dashboard/Artifacts/RepositoryCapabilityPanorama.html","sha256":"d952fd3e5ffc48fb8e715b93b8ca590ff78acb7912bbee9c369e0df2d8b5deda"},{"path":"Dashboard/Artifacts/RepositoryCapabilityPanorama_Audit_Report.md","sha256":"1d5d617f3cc471f613fc84cd8f91b236ebe6f14bd0e5cef9e2a320b27d780e7e"},{"path":"Dashboard/Artifacts/RepositoryCapabilityPanorama_Closeout.md","sha256":"1b1518d8a9af78ba94052494dead8f218a8c8a1ff1c07d1105aa986ffa4871c6"}],
  "mode":"full_baseline",
  "snapshot":{"snapshot_id":"repository-capability-panorama-final-validation-2026-09-04","parent_snapshot_ref":null},
  "delta_read_set":["original user request","AGENTS.md","SGE checkpoint Skill and SGC","Context/Design/lane cards/prompts/audit","Data/Markdown/HTML/Audit/Generator/Closeout","README/docs/public manifest/core Skill/tools/extensions/tests","Dashboard Current State/Stage Plans/Sessions/registry","kb canonical strategy/rendered docs","git final diff"],
  "acceptance_criteria_ids":["PAN-DESIGN-01","PAN-DESIGN-02","PAN-DESIGN-03","PAN-DESIGN-04"],
  "write_scope":["Dashboard/Artifacts/RepositoryCapabilityPanorama_ValidationReview.md","Dashboard/Artifacts/RepositoryCapabilityPanorama_ValidationStateSnapshot.json"],
  "required_outputs":["中文大白话解释任务声称什么、不证明什么","完整 Read Manifest 与原始目标逐项覆盖","独立重算 JSON/HTML/links/gates/CLI/残留分类/公开身份与最终 diff","blocking/non-blocking findings、Builder/Closure exception 影响、SGC SI-1..SI-6 与唯一 verdict","若有阻断不得修改 Builder 产物，不得给 pass/done"],
  "maximum_claim_ref":{"summary":"只在当前 checkout、最终 closeout 与实际 diff 范围内给独立 verdict；不证明正式开源发布。","authority_ref":"Dashboard/Artifacts/RepositoryCapabilityPanorama_Design.md"},
  "forbidden_claims_ref":"Dashboard/Artifacts/RepositoryCapabilityPanorama_ContextBootstrap.json",
  "topology":{"fork_context":false,"user_visible_required":false,"user_visible":false,"task_id":"repository-capability-panorama-final-validation","worktree":"."},
  "rebaseline_ref":"Dashboard/Artifacts/RepositoryCapabilityPanorama_ContextBootstrap.json",
  "working_directory":".",
  "execution_command":"只读验证最终全景 package 与 closeout，写 ValidationReview 和 snapshot；不得修复 Builder/Closure 产物"
}
