{
  "schema_version":"lane_task_card_v1",
  "card_id":"sp001-s003-governance-tooling-v1",
  "session_id":"SP-001/S-003",
  "lane":"S-003 governance tooling migration",
  "role":"builder",
  "source_goal":{"path":"Dashboard/Artifacts/Stage-Plan-SP-001/SP001_SGEGovernanceMigration_LoopGoal.md","sha256":"7e65566480056258433bdbeb7795357c92e09386b127d539735328275aedb881"},
  "base_context_refs":[{"path":"Dashboard/Artifacts/Stage-Plan-SP-001/SP001_S003_GovernanceTooling_ContextBootstrap.json","sha256":"724d8a633b5356f5ded6d7866dbf7167e961a4f6340ead7f1cb137fa119c29db"},{"path":"Dashboard/Artifacts/Stage-Plan-SP-001/SP001_S003_GovernanceTooling_Design.md","sha256":"5b49a014e45496c124052c6c77dadc16747c5b830d4943e41a99af83f2d13a41"},{"path":"Dashboard/Artifacts/Stage-Plan-SP-001/SP001_S002_SGECore_Closeout.md","sha256":"b718b64c5920564e7180ad22e2dc11587cb9688f7393b54c7b0fb6c378198a77"}],
  "mode":"full_baseline",
  "snapshot":{"snapshot_id":"sp001-s003-initial-2026-09-01","parent_snapshot_ref":null},
  "delta_read_set":[".codex/skills/sge-governed-checkpoints","kb/data/strategy","kb/schemas","Dashboard/tools/sge","Dashboard/Artifacts/Stage-Plan-SP-001/SP001_S003_*","Dashboard/Sessions.md","Dashboard/Current_State.md"],
  "acceptance_criteria_ids":["MH-04","MH-05","MH-08"],
  "write_scope":[".codex/skills/sge-governed-checkpoints","kb/data/strategy","kb/schemas","Dashboard/tools/sge","Dashboard/Artifacts/Stage-Plan-SP-001/SP001_S003_*","Dashboard/Sessions.md","Dashboard/Current_State.md"],
  "required_outputs":["portable tooling、workflow contract、schema 验证、中文 closeout 与独立 Validation"],
  "maximum_claim_ref":{"summary":"仅证明 S-003 治理 tooling 有界迁移，不证明产品或公共发布。","authority_ref":"Dashboard/Artifacts/Stage-Plan-SP-001/SP001_SGEGovernanceMigration_LoopGoal.md"},
  "forbidden_claims_ref":"Dashboard/Artifacts/Stage-Plan-SP-001/SP001_SGEGovernanceMigration_LoopGoal.md",
  "topology":{"fork_context":false,"user_visible_required":false,"user_visible":false,"task_id":"sp001-s003-governance-tooling-builder","worktree":"."},
  "rebaseline_ref":"Dashboard/Artifacts/Stage-Plan-SP-001/SP001_S003_GovernanceTooling_ContextBootstrap.json",
  "working_directory":".",
  "execution_command":"python3 .codex/skills/sge-governed-checkpoints/scripts/workflow_contract.py --stage full"
}
