{
  "schema_version": "lane_task_card_v1",
  "card_id": "sp001-s015-final-integrated-semantic-v1",
  "session_id": "SP-001/S-015",
  "lane": "SP-001 final integrated semantic review before state closure",
  "role": "semantic",
  "source_goal": {"path": "Dashboard/Artifacts/SP001_SGEGovernanceMigration_LoopGoal.md", "sha256": "7ff403cb0b82b5fa4305bc39b5150625f30a4da2ba40ef4d8e344d19995982a5"},
  "base_context_refs": [
    {"path": "Dashboard/Artifacts/SP001_S015_PostPromotionValidation.md", "sha256": "4e8a100f44d5bc107ee02d4c81e0e2929ea374f067167758d9fa6dc460e9e4d7"},
    {"path": "Dashboard/Artifacts/SP001_S015_SemanticReview_TopologyReconciliation.md", "sha256": "14613f18006b616e4ba5aa40f175b42a4529b72a8e34c5c2dc4afdf21b8fe33f"},
    {"path": "Dashboard/Artifacts/SP001_S015_FinalClosure_OPCM.md", "sha256": "80bd62e1493943b47a9eef5ae9f1752c3950071c27398b9c7258c5f1ba1585cd"},
    {"path": "Dashboard/Artifacts/SP001_S015_FinalClosure_Closeout.md", "sha256": "a3872b9ecbf3e9fc366ff4708dedee349120466d1a9b94f612c0d5fa8739a126"}
  ],
  "mode": "delta",
  "snapshot": {"snapshot_id": "sp001-s015-final-integrated-semantic-2026-09-02", "parent_snapshot_ref": "Dashboard/Artifacts/SP001_S015_SemanticReview_TopologyReconciliation.md"},
  "delta_read_set": [
    "Dashboard/Artifacts/SP001_S015_KBPromotionDecision.md",
    "Dashboard/Artifacts/SP001_S015_PostPromotionValidation.md",
    "Dashboard/Artifacts/SP001_S015_FinalClosure_OPCM.md",
    "Dashboard/Artifacts/SP001_S015_FinalClosure_Closeout.md",
    "Dashboard/Artifacts/SP001_S013_SemanticGovernance_Closeout.md",
    "Dashboard/Agent_Logs/2026-09-02__SP-001-S012-S014__builder.md",
    "kb/data/strategy/strategy_human_ai_development.json",
    "kb/data/strategy/strategy_semantic_surface_engineering.json",
    "kb/data/strategy/strategy_kb_promotion_and_source_policy.json",
    "kb/docs/strategy",
    "Dashboard current state and complete diff"
  ],
  "acceptance_criteria_ids": ["active truth placement", "state compression safety", "future-agent misuse", "bounded topology exception", "Design Freeze Validity", "Implementation Entry Readiness", "controlled state closure readiness"],
  "write_scope": ["Dashboard/Artifacts/SP001_S015_SemanticReview.md"],
  "required_outputs": ["Dashboard/Artifacts/SP001_S015_SemanticReview.md", "Design Freeze Validity", "Implementation Entry Readiness", "state wording verdict", "allowed state mutations", "remaining post-closeout prerequisites"],
  "maximum_claim_ref": {"summary": "最多确认 active semantic package 可进入受控状态收束；不预先证明 mutation 后状态或 post-closeout。", "authority_ref": "Dashboard/Artifacts/SP001_S015_PostPromotionValidation.md"},
  "forbidden_claims_ref": "Dashboard/Artifacts/SP001_QualityRecovery_ERBE_Contract.json",
  "topology": {"fork_context": false, "user_visible_required": false, "user_visible": false, "task_id": "sp001-s015-final-integrated-semantic", "worktree": "."},
  "rebaseline_ref": "Dashboard/Artifacts/SP001_S015_FinalValidation_ContextBootstrap.json",
  "working_directory": ".",
  "execution_command": "python3 kb/tools/render_kb.py --check"
}
