{
  "schema_version": "lane_task_card_v1",
  "card_id": "s001-sge-governance-planning-landing-validation-v1",
  "session_id": "SP-001/S-001",
  "lane": "S-001 planning landing independent validation",
  "role": "validation",
  "source_goal": {
    "path": "Dashboard/Artifacts/SP001_SGEGovernanceMigration_LoopGoal.md",
    "sha256": "30dc6353d175ebb954d6d010f822753a8397ceba68fc501b66fdc3ee57047d2a"
  },
  "base_context_refs": [
    {"path": "AGENTS.md", "sha256": "941bb5b61c46016ea729557de35be13015d261e88b7ef99c7619fa487f5d41d8"},
    {"path": "Dashboard/Rules.md", "sha256": "d78eabfa76425df181a5e9569e0fae52540b66fc009893d3dec68bb45fa3f3c5"},
    {"path": "Dashboard/Artifacts/SP001_SGEGovernanceMigration_Plan.md", "sha256": "e58deed4b0466b77ca263dc6e5560beba4fe6d06c61f8487242ff141cdb26cf6"},
    {"path": "Dashboard/Artifacts/SP001_SGEGovernanceMigration_ContextBootstrap.json", "sha256": "6a57027142c1b6ec61f0396b88dfd25dd0834b9cae59da430cd7b680da87f595"},
    {"path": "Dashboard/Artifacts/S001_SGEGovernancePlanningLanding_Design.md", "sha256": "2394f176e82f5a94ff84195599122388af7346973c0ace28bf4823682474da79"},
    {"path": "Dashboard/Artifacts/S001_SGEGovernancePlanningLanding_Closeout.md", "sha256": "cf556c2232f187952cd8ff410c40c8aac9114d55f5d294efe562f02941af3401"},
    {"path": "Dashboard/Agent_Logs/2026-09-01__S-001__closure.md", "sha256": "ae348edbf72be9e0051dcc9496d06f841615be252f746e1eb462e166541c3949"},
    {"path": "Dashboard/Sessions.md", "sha256": "0ef5d032c93ce6eb777d02a3fa83ced2ad4ecf5203494d470d05dbeb4aabab8a"},
    {"path": "Dashboard/Stage_Plans.md", "sha256": "d77ebae016d3c25d8769ac80e183945aa05a1df526bf72c1df6a16da56095f0c"},
    {"path": "Dashboard/Current_State.md", "sha256": "db6b150c83ca6d51c70ff60b8f5cc7a7571d58a9d99900a8ab2b6272750bc041"},
    {"path": "Dashboard/Artifacts_Index.md", "sha256": "fb2a0b24f1c1c09e2703381e79cdfe5030f3ec9d6b2ffb099f4dac0d99f2d6c1"},
    {"path": "Dashboard/Decisions.md", "sha256": "8136adb7eea8c72822d4e079a6dba135db25b33a365699442b6deef6d57ac883"},
    {"path": "Dashboard/Exceptions.md", "sha256": "5de8543b9792e7643890fd1636cbbc44a343c7e1825db13cc94c7c03020fe760"},
    {"path": "Dashboard/Session_Index.md", "sha256": "2f5cd77c58c11236d146632a076ba8c46e4162f9fe5c55bb755943f4e5c585fd"},
    {"path": "Dashboard/Archives/Sessions/archive_manifest.json", "sha256": "43af18c53fbcea7af5f39ff17708bc8d5d8257ad867dc47988bcd1fecd6a3024"},
    {"path": "Dashboard/Archives/Sessions/Legacy_Execution_Notes.md", "sha256": "ad7d64476ed7defc172a74dc25b52f0c4b1141367fbf743b6461ce17e8fffcca"},
    {"path": "kb/bm-doc/audio-transcriptor-skill_design_v1.0.md", "sha256": "3ca2d5f98991b05612b06647e25e65319c0850d6909a14e760aa095f433d17f4"}
  ],
  "mode": "full_baseline",
  "snapshot": {
    "snapshot_id": "s001-planning-landing-validation-baseline-2026-09-01",
    "parent_snapshot_ref": null
  },
  "delta_read_set": [
    "Dashboard/Artifacts/*S001*",
    "Dashboard/Artifacts/*SP001*",
    "Dashboard/Agent_Logs/*S-001*",
    "Dashboard/Big_Ideas.md",
    "Dashboard/Stage_Plans.md",
    "Dashboard/Sessions.md",
    "Dashboard/Session_Index.md",
    "Dashboard/Current_State.md",
    "Dashboard/Artifacts_Index.md",
    "Dashboard/Decisions.md",
    "Dashboard/Exceptions.md",
    "Dashboard/Archives/Sessions/*",
    "kb/bm-doc/audio-transcriptor-skill_design_v1.0.md"
  ],
  "acceptance_criteria_ids": ["S001-AC-01", "S001-AC-02", "S001-AC-03", "MH-01", "MH-02", "MH-03", "MH-04", "MH-05", "MH-06", "MH-07", "MH-08", "MH-09", "MH-10"],
  "write_scope": [
    "Dashboard/Artifacts/S001_SGEGovernancePlanningLanding_ValidationReview.md",
    "Dashboard/Agent_Logs/2026-09-01__S-001__validation.md"
  ],
  "required_outputs": [
    "按固定 Validation Agent Prompt 输出中文任务理解、完整 Read Manifest、Evidence Completeness、blocking/non-blocking findings、Scope narrowing/overclaim、gate sufficiency、KB/Dashboard split、repair 与 verdict",
    "独立重算 seed/current 原始设计摘要、Context validator、registry check/validate、closeout-language、Markdown links、tracked/untracked diff 与 S-002 未启动状态",
    "逐项审查 MH-01..10 与 S001-AC-01..03 OPCM；区分 S-001 关闭判定和 parent SP-001 未启动",
    "只在全部当前关闭前置满足时给出允许 Orchestrator 执行 Doing-to-Done 状态收束的有界 verdict；不得把该 verdict 冒充关闭后最终 reconciliation",
    "记录 Semantic Reviewer trigger 裁决、DKG 缺失的 blocker admissibility 与任何需修复项"
  ],
  "maximum_claim_ref": {
    "summary": "只对 S-001 规划落库候选给独立关闭前 Validation；不得声明 SP-001、SGE 迁移或产品实现完成。",
    "authority_ref": "Dashboard/Artifacts/SP001_SGEGovernanceMigration_LoopGoal.md"
  },
  "forbidden_claims_ref": "Dashboard/Artifacts/SP001_SGEGovernanceMigration_LoopGoal.md",
  "topology": {
    "fork_context": false,
    "user_visible_required": false,
    "user_visible": false,
    "task_id": "s001-planning-landing-validation-agent",
    "worktree": "."
  },
  "rebaseline_ref": "Dashboard/Artifacts/SP001_SGEGovernanceMigration_ContextBootstrap.json",
  "working_directory": ".",
  "execution_command": "git status --short"
}
