{
  "schema_version": "lane_task_card_v1",
  "card_id": "sp002-s007-public-contract-design-v1",
  "session_id": "SP-002/S-007",
  "lane": "S-007 public contract and glossary design",
  "role": "design",
  "source_goal": {"path": "Dashboard/Artifacts/Stage-Plan-SP-002/SP002_SGEOpenSourceNewcomerReadiness_LoopGoal.md", "sha256": "f5748bbe772bd0f7cd115959902b80c515c9f7377bfbe3c182c200820dc83508"},
  "base_context_refs": [
    {"path": "AGENTS.md", "sha256": "1362597c1fa59259b09004f7b52aebb4a485eab7c6ac944596d124e0827ed6a5"},
    {"path": "Dashboard/Rules.md", "sha256": "fb86b3143636dee7941541134031c928d405fe09daf128c6ff98835cd27a4aa2"},
    {"path": "Dashboard/Methodology.md", "sha256": "90ce8ff7d5fb10d5927120a8ba607bdf74c986d5557757623a50c35fc0b8b600"},
    {"path": "Dashboard/Artifacts/Stage-Plan-SP-002/SP002_SGEOpenSourceNewcomerReadiness_GoalPatch.md", "sha256": "3f3a3043adbdbfd0b6f0d106412ed6941a0f7cbb8bec59705530362d88646123"},
    {"path": "Dashboard/Artifacts/Stage-Plan-SP-002/SP002_SGEOpenSourceNewcomerReadiness_StagePlan.md", "sha256": "41a94a68fd39f231991a22267941e6cf5905e15e737fe351e5aeb0432dfdc298"}
  ],
  "mode": "full_baseline",
  "snapshot": {"snapshot_id": "sp002-s007-design-baseline-2026-09-02", "parent_snapshot_ref": null},
  "delta_read_set": [],
  "acceptance_criteria_ids": ["SP002-MH-01", "SP002-MH-02", "SP002-MH-03", "SP002-MH-11", "SP002-MH-12", "S007-AC-01", "S007-AC-02"],
  "write_scope": ["Dashboard/Artifacts/Stage-Plan-SP-002/SP002_S007_Design.md"],
  "required_outputs": ["冻结公共/私有四层边界、四层依赖与安装顺序", "设计 glossary v1 schema、候选术语与排除规则", "设计 default-deny manifest 与逐文件 provenance/license 判定", "列出 negative cases、ERBE predicates、invariants、非目标与实施梯子"],
  "maximum_claim_ref": {"summary": "只形成 S-007 Design Handoff，不声称已实现、已验证或已发布公共候选。", "authority_ref": "Dashboard/Artifacts/Stage-Plan-SP-002/SP002_SGEOpenSourceNewcomerReadiness_LoopGoal.md"},
  "forbidden_claims_ref": "Dashboard/Artifacts/Stage-Plan-SP-002/SP002_SGEOpenSourceNewcomerReadiness_LoopGoal.md",
  "topology": {"fork_context": false, "user_visible_required": false, "user_visible": false, "task_id": "sp002-s007-design-agent", "worktree": "."},
  "rebaseline_ref": "Dashboard/Artifacts/Stage-Plan-SP-002/SP002_SGEOpenSourceNewcomerReadiness_GoalContextBootstrap.json",
  "working_directory": ".",
  "execution_command": "git diff -- Dashboard/Artifacts/Stage-Plan-SP-002/SP002_S007_Design.md"
}
