{
  "schema_version": "lane_task_card_v1",
  "card_id": "sp004-s027-release-candidate-preflight-v1",
  "session_id": "SP-004/S-027",
  "lane": "S-027 最终 release candidate、rights 与发布包预检",
  "role": "closure",
  "source_goal": {"path": "Dashboard/Artifacts/Stage-Plan-SP-004/SP004_SemxResidueOpenSourceGaps_LoopGoal.md", "sha256": "b4c4bd4804f78e2ed1b0e97a6747ae5b0b64f41824d5f9bfa0f8615d1a1dbefb"},
  "base_context_refs": [
    {"path": "Dashboard/Artifacts/Stage-Plan-SP-004/SP004_S025_Closeout.md", "sha256": "ab8c8e3554df24f53337d98f0686745129763a0ed97753e38e805303b77a79b1"},
    {"path": "Dashboard/Artifacts/Stage-Plan-SP-004/SP004_S025_FinalValidationStateSnapshot.json", "sha256": "cf23be696a0e9659ad3cf90a7d19774605bd111e585bf6ca6f82090dd8a26980"},
    {"path": "public_export_manifest_v1.json", "sha256": "3a5dc8478098a19e4c52103c7fbeef28501b692c39d995bbaaa81c8557f5d38b"},
    {"path": "tools/sge_public.py", "sha256": "1852bd84facb06802476d9872e1afc1fa67f725248a64ac4410abd795bf7427f"}
  ],
  "mode": "full_baseline",
  "snapshot": {"snapshot_id": "sp004-s027-release-preflight-baseline-2026-09-05", "parent_snapshot_ref": null},
  "delta_read_set": ["public_export_manifest_v1.json", "tools/sge_public.py", "LICENSE", "NOTICE", "README.md", "kb/", "docs/", "extensions/", "S-025 final validation snapshot", "SP-004 S-027 section"],
  "acceptance_criteria_ids": ["GAP-MH-05", "GAP-MH-06", "AC-08", "AC-09", "AC-11", "SGC-SI-1..SI-6"],
  "write_scope": ["Dashboard/Artifacts/Stage-Plan-SP-004/SP004_S027_ReleaseCandidatePreflight.md", "Dashboard/Artifacts/Stage-Plan-SP-004/SP004_S027_ReleaseCandidatePreflight.json", "Dashboard/Artifacts/Stage-Plan-SP-004/SP004_S027_SHA256SUMS.txt", "Dashboard/Artifacts/Stage-Plan-SP-004/SP004_S027_LicenseReport.md", "Dashboard/Artifacts/Stage-Plan-SP-004/SP004_S027_RightsConfirmation.md", "Dashboard/Artifacts/Stage-Plan-SP-004/SP004_S027_ReleaseNotes.md", "Dashboard/Artifacts/Stage-Plan-SP-004/SP004_S027_CIWorkflowCandidate.yml", "Dashboard/Artifacts/Stage-Plan-SP-004/SP004_S027_RollbackReadbackPlan.md", "Dashboard/Artifacts/Stage-Plan-SP-004/SP004_S027_ValidationReview.md"],
  "required_outputs": ["exact candidate/tree/manifest/tool digest", "owner/repo/branch/version/tag/payload proposal", "SHA256SUMS", "license/NOTICE/copyright report", "逐文件 rights confirmation 表", "release notes", "CI workflow candidate", "rollback/revocation/read-back plan", "pending human confirmation blocker"],
  "maximum_claim_ref": {"summary": "最多支持 release candidate preflight complete；不支持 rights_approved、release_authorized、published 或 production_ready。", "authority_ref": "Dashboard/Artifacts/Stage-Plan-SP-004/SP004_SemxResidueOpenSourceGaps_LoopGoal.md"},
  "forbidden_claims_ref": "Dashboard/Artifacts/Stage-Plan-SP-004/SP004_SemxResidueOpenSourceGaps_LoopGoal.md",
  "topology": {"fork_context": false, "user_visible_required": false, "user_visible": false, "task_id": "orchestrator-local-preflight", "worktree": "."},
  "rebaseline_ref": "Dashboard/Artifacts/Stage-Plan-SP-004/SP004_S025_FinalValidationStateSnapshot.json",
  "working_directory": ".",
  "execution_command": "在当前 checkout 做只读 candidate export/verify、digest/license/rights/release packet 生成；不得 push、tag、release、调用远端或写入 rights approval。"
}
